<?xml version="1.0" encoding="UTF-8"?>
<ns0:jaxbDeviceList xmlns:xsi="http://www.w3.org/2001/XMLSchema-instance" 
		xmlns:ns0="de/uniluebeck/itm/tcp/JaxDevices"
		xsi:schemaLocation="de/uniluebeck/itm/tcp/JaxDevices devices.xsd ">
 
 	<ns0:jaxbDevice>
 		<ns0:DeviceId>1</ns0:DeviceId>
        <ns0:DeviceType>de.uniluebeck.itm.rsc.drivers.core.mockdevice.MockDevice</ns0:DeviceType>
        <ns0:ConnectionType>de.uniluebeck.itm.rsc.drivers.core.mockdevice.MockConnection</ns0:ConnectionType>
        <ns0:Port>1111</ns0:Port>
    </ns0:jaxbDevice>
    <ns0:jaxbDevice>
 		<ns0:DeviceId>2</ns0:DeviceId>
        <ns0:DeviceType>de.uniluebeck.itm.rsc.drivers.core.mockdevice.MockDevice</ns0:DeviceType>
        <ns0:ConnectionType>de.uniluebeck.itm.rsc.drivers.core.mockdevice.MockConnection</ns0:ConnectionType>
        <ns0:Port>1112</ns0:Port>
    </ns0:jaxbDevice> <!-- 
    <ns0:jaxbDevice>
 		<ns0:DeviceId>3</ns0:DeviceId>
        <ns0:DeviceType>de.uniluebeck.itm.rsc.drivers.core.pacemate.PacemateDevice</ns0:DeviceType>
        <ns0:ConnectionType>de.uniluebeck.itm.rsc.drivers.core.generic.iSenseSerialPortConnection</ns0:ConnectionType>
        <ns0:Port>COM21</ns0:Port>
    </ns0:jaxbDevice>
     
     
     <ns0:jaxbDevice>
     	<ns0:DeviceId>4</ns0:DeviceId>
        <ns0:DeviceType>de.uniluebeck.itm.rsc.drivers.core.jennic.JennicDevice</ns0:DeviceType>
        <ns0:ConnectionType>de.uniluebeck.itm.rsc.drivers.core.generic.iSenseSerialPortConnection</ns0:ConnectionType>
        <ns0:Port>COM19</ns0:Port>
    </ns0:jaxbDevice>
    -->
</ns0:jaxbDeviceList>
